{
  "schema": "cloudx.handshake.v1",
  "productVersion": "0.1.15",
  "buildCommit": "0000000",
  "protocol": {"min": 1, "max": 1},
  "capabilities": [
    "account-state-adapter.v1",
    "capacity.v1",
    "client-config.v1",
    "import-compatibility-script.v1",
    "cpa-health-native.v1",
    "cpa-health-templates.v1",
    "health.v1",
    "health-publisher-templates.v1",
    "http-importer-stop-gate.v1",
    "import.v1",
    "legacy-gateway.v1",
    "phi-cloud-consumer-credential.v1",
    "phi-cloud-consumer-traffic-policy.v1",
    "phi-mesh-compatibility-profile.v1"
  ],
  "deploymentId": "shadow-local",
  "gateway": {"version": "external", "status": "unknown"},
  "importerContractVersion": 1
}
